{
  "schemaVersion": 8,
  "id": "legacy-project-id",
  "name": "BG-01 legacy hall",
  "architecture": "Mixed",
  "createdAt": "2026-10-22T12:00:00.000Z",
  "updatedAt": "2026-10-22T13:00:00.000Z",
  "building": {
    "id": "legacy-building-id",
    "sections": [
      {
        "id": "legacy-section-id",
        "kind": "rectangle",
        "position": {
          "x": -1251,
          "y": 2837,
          "z": 950
        },
        "length": 13247,
        "width": 8751,
        "wallThickness": 251,
        "orientation": 37.5,
        "floorCount": 4,
        "name": "Main building",
        "type": "Custom",
        "locked": false,
        "exterior": {
          "material": "Mixed",
          "wallHeight": 3600,
          "roofPitch": 40,
          "roofStyle": "Gable",
          "overhang": 350,
          "stylePreset": "Mixed Architectural Fantasy",
          "detailLevel": "Standard",
          "covering": "Wood shingles",
          "windows": [],
          "features": [],
          "ridgeAxis": "Auto",
          "shedHighEdge": "Auto"
        }
      }
    ],
    "mainSectionId": "legacy-section-id",
    "frame": {
      "origin": {
        "x": -1251,
        "y": 2837
      },
      "axis": 37.5,
      "rotation": 0,
      "mode": "legacy"
    },
    "connections": [],
    "interior": {
      "partitions": [],
      "rooms": []
    },
    "openings": []
  }
}
